title,description,channelTitle,channelSubscribers,viewCount
☆피자나라치킨공주~ 갈릭스테이크피자와 페퍼간장치킨 먹방~ 피자와 치킨을 한꺼번에 먹으닌까 좋은데~!!,다정한부부♡계좌후원♡진심으로 감사드립니다 신협 전×× 132-078-310-323 다정한부부♡멤버쉽 가입♡ ...,다정한부부 a loving couple,Unknown,9665
최초공개‼️ 역대급 기괴한 김희철 집 싹 다 공개(두둥) 방보다 화장실이 더 많다고?!🫢🫢 | 아침먹고 가2 EP.18,아는 형님으로 주가 올린 돈이 진짜 많은 20년 차 KPOP 아이돌 슈퍼주니어 김희철 집 최초 공개! 와이프를 위해 살고 싶다는 SM 대표 ...,스튜디오 수제,Unknown,256884
24시간 하루종일 돈까스 제육볶음 라면 국밥 남자들의 소울푸드 먹방 공화춘 짬뽕 치즈돈까스 순대국밥 돼지국밥 수육 순대 편육 korean mukbang eating show,24시간 하루종일 돈까스 제육볶음 라면 국밥 남자들의 소울푸드 먹방 공화춘 짬뽕 치즈돈까스 순대국밥 돼지국밥 수육 순대 편육 ...,상해기SangHyuk,Unknown,21921
[🔴LIVE] 《맛있는 녀석들》 많이 기다리셨죠? &quot;탄수화물&quot; 특집 스트리밍,포함 회차 2회 면요리 편 11회 짬뽕 & 스테이크 맛집 13회 수제비 & 아귀찜 맛집 16회 물갈비 & 마트피자 편 27회 쌀국수 & 제육볶음 ...,맛있는 녀석들 (Tasty Guys),Unknown,125173
먹방이로그) 만칼로리 먹기 전 다이어트? 작심2일!😩  (맘스터치 싸이버거+치즈볼/로제떡볶이+닭껍질튀김/한식집밥/디저트먹방/케이크/빵 먹방/요아정/두바이초코/교촌허니콤보,화질 설정 후 감상해주세요* 0:01 [맘스터치] 싸이버거+치즈볼+치즈뿌치치킨!   6:50 [리틀비터] 갸또케이크3종       9:50 [아차산 ...,가오니의 메뉴판GAONI,Unknown,282120
국내 1등 미친크기! 10kg 괴물떡볶이 도전먹방 20분안에 다먹으면 100만원?! Jumbo tteokbokki challenge mukbang,"국내 1등 미친크기! 10kg 괴물떡볶이 도전먹방 20분안에 다먹으면 100만원?! Jumbo tteokbokki challenge mukbang □매주 일,화, ...",상해기SangHyuk,Unknown,228716
살아있는 독도새우 100마리 도전!👊 꽃새우 닭새우 먹방,"각국어 번역 자막 제작 : 컨텐츠 제작의 마무리는 컨텐츠플라이! 글로벌 진출을 위한 최고의 파트너, CONTENTSFLY에서 제작 ...",tzuyang쯔양,Unknown,681506
치킨 먹은 다음 날 사망…필리핀 &#39;먹방 금지&#39; 검토｜지금 이 뉴스,필리핀에서 한 유명 크리에이터가 '먹방' 영상을 올린 다음 날 숨지자 보건당국이 '먹방' 금지를 검토하고 있습니다. 필리핀 내에서는 ...,JTBC News,Unknown,35196
"[먹방 브이로그] 비건빵은 8개 먹어도 살 안찌나요? 글루텐 프리, 트랜스 지방 0g이니까 살 안찌나요?(아님)ㅣ교촌 허니콤보, 짜파게티, 불닭, 찹싸루니, 삼겹살, 비빔면 파티ㅋ",본 영상은 맛있는 비건빵 '망넛이네'의 유료 광고를 포함하고 있습니다. 망넛이네X최저가 구매 링크 : https://hity.io/5OZtYMoR ...,미소miso,Unknown,103426
[시골먹방] 장마철 오봇하게 모정에서 돼지목살구이 먹방 [Grilled Pork Shoulder] MUKBANG/EATING SHOW,인트로(Intro) 00:00 ~ 00:40 먹방시작(Start eating) 00:41~ 《먹두리 후원계좌》 농협 백성열 302 0303 0586 01 시청 후 구독 ...,"먹두리,Mukduri",Unknown,51544
"퇴근 후, 부장님과 양꼬치&amp;맥주 먹방! (양꼬치,꿔바로우,마파두부) / Lamb skewers&amp;Beer Mukbang! / Animation ASMR",오늘은 아빠와 회사 부장님과 함께 양꼬치&맥주 그리고 꿔바로우와 마파두부까지 맛있게 푸먹했어요~ 그럼 오늘도 재밌게 ...,푸먹_foomuk,Unknown,187203
🔥먹방에 진심인 자 VS 요리에 진심인 자🔥 100만원어치 중식코스요리.. 미쳤습니다,구독과 좋아요! 공유 부탁드립니다! 영상을 통해 많은 도움이 되셨으면 좋겠습니다 #먹방 #중국집 #일하는용형 #랭킹닭컴 *비즈니스 ...,지피티,Unknown,346629
"&quot;사장님 : 태어나서 밥 7공기 먹는 사람 처음봐요!!😲&quot; 청국장에 제육볶음, 오징어볶음이면 7공기도 더 먹을 수 있어요 ㅋㅋㅋ 만리 한식 먹방 mukbang",한식 #청국장 #제육볶음 #만리 #먹방 ✨비즈니스메일 : manli@alohamedia.co.kr ✨인스타그램 : manlipig 안녕하세요 여러분! 오늘은 ...,만리 manli,Unknown,115023
치토스로 체감되는 요즘 물가,shorts #과자 #치토스 #먹방 #물가 #snacks #cheetos #past #future #funny #comedy #memes instagram: yeongmin0917 business ...,진영민yeongmin,Unknown,9393607
두바이초콜릿이 CU에서 나왔다고?? 4000원을 주고 사먹을 만 할까?,쇼츠 #shorts.,이상한 과자가게  weird sweets shop,Unknown,1014950
손잡이부터 먹는 15만원짜리 치킨,For copyright matters and any suggestions be welcome at : yuzuya07@gmail.com and I'll get back to you ASAP.,아이앤지식,Unknown,3942429
"일상 먹방 브이로그:) 대전 삼바리 매운🥵 낙지구이, 호연재 숯불 닭구이, 크라운 호프🍻, 온천 칼국수, 블레스롤 쿠팡밥 등등 먹방 mukbang v-log","일상 먹방 브이로그:) 대전 삼바리 매운   낙지구이, 호연재 숯불 닭구이, 크라운 호프  , 온천 칼국수, 블레스롤 쿠팡밥 등등 먹방 ...",용용먹방 YongYong,Unknown,11612
CU 최초 대왕 라면 먹방 세팅해보자,,돼끼 baby_pig_rabbit,Unknown,211075
치킨으로 체감되는 요즘 물가,shorts #치킨 #물가 #먹방 #chicken #kfc #future #past #mukbang instagram: yeongmin0917 business mail: ...,진영민yeongmin,Unknown,4470708
먹다 매워서 처음으로 눈물 흘린 날,아프리카tv 맵하니 방송국 https://bj.afreecatv.com/krpssamq 이메일 rpssamo@naver.com 각국어 번역 자막 제작 : 컨텐츠 제작의 ...,맵하니Maphany,Unknown,121031
마라탕 비조리 포장의 장점과 단점은⁉️,마라탕 #마라탕먹방 #김채옹이 주인장 인스타: chaeong_2 룽지 인스타: nurungiii__.,김채옹이 CHONG,Unknown,156587
사장님이 혼낸다는 식당..? 안혼나는법 공유합니다..🥹,미니로운생활 #리뷰 #맛집 #먹방.,미니로운생활,Unknown,1096292
15. 햄버거세트로 삼시세끼,,고기남자,Unknown,3809372
"해외에서,엄청 짠 도리토스를..!더 짜게 먹는 방법 (하지만 맛있죠?)",쇼츠 #shorts.,이상한 과자가게  weird sweets shop,Unknown,1863258
ASMR MUKBANG 체다치즈 양념 치킨먹방! 치즈 떡볶이 명랑핫도그 CRISPY FRIED CHICKEN HOT DOG EATING SOUND! #9,ASMR MUKBANG 체다치즈 양념 치킨먹방! 치즈 떡볶이 명랑핫도그 CRISPY FRIED CHICKEN HOT DOG EATING SOUND! #9.,Honey Jelly,Unknown,635343
ASMR SWEET EMOJI FOOD 달콤한 이모지 먹방 (sped up),,당비 Dangbee EATING,Unknown,1433696
악플 먹방😈 #shorts 악플 씹어먹기🔪,악플읽기 #악플 #먹방 #제리얌.,제리얌 Jelly Yum,Unknown,126358
"[먹방브이로그] 여름 네가 기어코 왔구나..(엽떡, 허니콤보, 크러시 맥주, 공간춘 점보라면, 냉소바, 치즈돈까스, 간장국수, 대창)",먹방브이로그 #브이로그 #먹방 ✉️ : juseunghee517@gmail.com.,승희얌 Yum,Unknown,22794
"먹방 먹는 소리, Eating faster like a good girl #asmr #mukbang #satisfying #020","SUB 한국자막입니다, thanks for watching       【ASMR】신기한물먹방 ASMR DRINKING #shorts 【ASMR】Renkli içecek içme ...",MUKBANG ASMR ,Unknown,277691
Cu 두바이 초콜릿 먹방🍫💚 #포카계 #포카포장 #포카깡 #아이브 #다이브로그 #다이브 #ive #깡 #포장계 #두바이초콜릿 #씨유,,독감쟈,Unknown,131311
행성 초콜렛 먹방🪐 줄게 내 갤럭시~,shorts #행성초콜렛 #초콜렛 #이모티콘 #이모티콘먹방 #먹방 #맛평가 #asmr.,현오 HyunO,Unknown,322748
메이커 양념통닭 파김치 짜장밥 오짬! 3분 짜장 참 오랜만인듯합니다 메이커통닭은 많이 비싸졌네요...먹방MUKBANG,항상 시청해주시는 모든분들 정말 감사합니다 인스타그램 : rasamgyeo 광고 협찬은 진행하지 않고 있습니다 감사합니다 #먹방 #집밥 ...,엽동,Unknown,72263
친구랑 호치민 먹방쇼,,댝생,Unknown,157294
#스케치코미디 #유머 #먹방 #유튜브 #또오숏,,짤짤이,Unknown,687827
Mukbang 지구젤리 눈알젤리 먹방 Earth jelly eyeball jelly DONA 도나,지구젤리 눈알젤리는 누가 먹을까요?? 도나의 가위바위보 먹방 대결! Who is going to eat Earth jelly and Eyeball jelly?? DONA's ...,DONA 도나,Unknown,136340
"ASMR DIY FRUITS CAKE, SOUR LEMON LIME 직접 만든 화과자, 레몬 라임, 수박화채 다양 과일 코하쿠토 무지개 EATING SOUNDS MUKBANG 먹방","ASMR MUKBANG (watermelon, orange, peach, blueberry, apple, corn)Fruit mochi, Wasashi, Mangosteen, Gold kiwi, Watermelon, ...",Hongyu ASMR 홍유,Unknown,3430743
엄마가 없는날 아이들의 식사,어릴때 엄마 없는날 먹은 시커먼 밥의 정체 #동원 #동원맛참 #맛참 #밥엔맛참 #초간편반찬.,김켈리 Kellyfornia,Unknown,1123027
실비 파김치에 짜파게티 한봉지 먹방,,돼끼 baby_pig_rabbit,Unknown,242950
홍석천 게이 아님??? #홍석천 #이원일 #먹방 #mukbang,shorts #홍석천 #이원일 #먹방 #mukbang #용리단길 #용산 #국정원.,홍석천이원일,Unknown,1816471
회사 점심시간에 대창 구워먹기 #대창 #먹방 #점심메뉴추천,shorts #대창구이 #통대창 회사에서 리뷰하는 사람은 처음이지? Music provided by 브금대통령 Track : Vinyl records ...,리뷰하는 회사원,Unknown,3399849
ASMR MUKBANG | 수박 디저트 아이스크림 탕후루 딸기 수박젤리 먹방 &amp; 레시피 DESSERT ICE CREAM WATERMELON TANGHULU,오늘은 수박 디저트를 준비했습니다~ 오늘 영상도 재밌게 봐주세요^^ 시오 구독하기   https://goo.gl/azcgUX 시오 인스타그램   ...,SIO ASMR,Unknown,2800960
Gs25에서 파는 파는 1600원짜리 평양냉면 육수?!,쇼츠 #shorts.,이상한 과자가게  weird sweets shop,Unknown,985684
씨유 두바이 초콜릿🍫 #삐야기 #삐따기 #씨유 #CU #먹방 #추천,,삐야기,Unknown,54376
계란밥엔 갓김치지❤️💚 #남매 #먹방,계란밥엔 갓김치지❤️   #남매 #갓김치 #먹방 #계란밥 #남매 #땡깡 #진절미 •instagram• 땡깡 @pactrosbims 진절미 ...,땡절스 DanJerous,Unknown,1057914
하이디라오 VS 마라탕 비싼 이유? (입문자 필수 시청ㅋ) #shorts,,미나상 ,Unknown,126075
백종원의 빽라면 사먹을만 할까!?,먹방 #라면 #빽라면 #라면먹방 #야식 #백종원 #백종원라면.,잇츠오니 ! (Eat's Oni ),Unknown,152158
500원으로 마라탕 먹기,또 보고 싶은 메뉴가 있다면 추천해주세요!,제로크림,Unknown,1316461
bbq 폼 미쳤다(진짜미침),핫베이크 #bbq #한입등갈비튀김.,두맨,Unknown,1037817
새벽에 부모님 몰래 라면 먹방 | Sneaky Ramen Mukbang | Animation ASMR,새벽에 부모님 몰래 라면 먹방 과연 세라와 동충이는 성공할 수 있을까? 각국어 번역 자막 제작: 컨텐츠 제작의 마무리는 컨텐츠플라이!,키에커,Unknown,607232
달디달고 달디단 양갱이 다양한 맛 먹방😋 마지막에 한번에 다먹는다!,shorts #양갱 #이모티콘 #이모티콘먹방 #먹방 #맛평가 #asmr.,현오 HyunO,Unknown,380706
